SQL> connect system
Enter password:
Connected.
SQL> desc Details
 Name                                      Null?    Type
 ----------------------------------------- -------- ----------------------------
 ID                                                 NUMBER(5)
 NAME                                               VARCHAR2(20)
 SALARAY                                            NUMBER(8)

SQL> create table Detail(id number(5),name varchar2(20),salary number(8));

Table created.

SQL> insert into Detail values(101,'Logesh',1500000);

1 row created.


SQL> insert into Detail values(101,'Gokul',1500000);

1 row created.

SQL> insert into Detail values(102,'Nithaj',1500000);

1 row created.

SQL> insert into Detail values(103,'Yeshwanth',1500000);

1 row created.

SQL> insert into Detail values(104,'Gladson',1500000);

1 row created.

SQL> insert into Detail values(105,'Ajith',1500000);

1 row created.

SQL> select * from Detail;

        ID NAME                     SALARY
---------- -------------------- ----------
       101 Logesh                  1500000
       101 Gokul                   1500000
       102 Nithaj                  1500000
       103 Yeshwanth               1500000
       104 Gladson                 1500000
       105 Ajith                   1500000

6 rows selected.


SQL> commit;

Commit complete.


SQL> select * from Detail;

        ID NAME                     SALARY
---------- -------------------- ----------
       101 Logesh                  1500000
       101 Gokul                   1500000
       102 Nithaj                  1500000
       103 Yeshwanth               1500000
       104 Gladson                 1500000
       105 Ajith                   1500000

6 rows selected.

SQL> select * from Detail where id in(101,102,105);

        ID NAME                     SALARY
---------- -------------------- ----------
       101 Logesh                  1500000
       101 Gokul                   1500000
       102 Nithaj                  1500000
       105 Ajith                   1500000

SQL> select * from Detail where id not in(101,102,105);

        ID NAME                     SALARY
---------- -------------------- ----------
       103 Yeshwanth               1500000
       104 Gladson                 1500000



SQL> select * from Detail where salary between 1000000 and 1000000000;

        ID NAME                     SALARY
---------- -------------------- ----------
       101 Logesh                  1500000
       101 Gokul                   1500000
       102 Nithaj                  1500000
       103 Yeshwanth               1500000
       104 Gladson                 1500000
       105 Ajith                   1500000

6 rows selected.

SQL> select * from Detail where id in (101,103,105) and salary>145000;

        ID NAME                     SALARY
---------- -------------------- ----------
       101 Logesh                  1500000
       101 Gokul                   1500000
       103 Yeshwanth               1500000
       105 Ajith                   1500000

SQL> select * from Detail where id in (101,103,105) or  salary>145000;

        ID NAME                     SALARY
---------- -------------------- ----------
       101 Logesh                  1500000
       101 Gokul                   1500000
       102 Nithaj                  1500000
       103 Yeshwanth               1500000
       104 Gladson                 1500000
       105 Ajith                   1500000

6 rows selected.


SQL> insert into Detail (id,salary)values (106,3000000);

1 row created.

SQL> commit;

Commit complete.

SQL> select * from Detail;

        ID NAME                     SALARY
---------- -------------------- ----------
       101 Logesh                  1500000
       101 Gokul                   1500000
       102 Nithaj                  1500000
       103 Yeshwanth               1500000
       104 Gladson                 1500000
       105 Ajith                   1500000
       106                         3000000

7 rows selected.

SQL> select * from Detail where name is null;

        ID NAME                     SALARY
---------- -------------------- ----------
       106                         3000000

SQL> select * from Detail where name is not  null;

        ID NAME                     SALARY
---------- -------------------- ----------
       101 Logesh                  1500000
       101 Gokul                   1500000
       102 Nithaj                  1500000
       103 Yeshwanth               1500000
       104 Gladson                 1500000
       105 Ajith                   1500000

6 rows selected.

SQL> commit;

Commit complete.

SQL> rollback;

Rollback complete.

SQL> select * from Detail;

        ID NAME                     SALARY
---------- -------------------- ----------
       101 Logesh                  1500000
       101 Gokul                   1500000
       102 Nithaj                  1500000
       103 Yeshwanth               1500000
       104 Gladson                 1500000
       105 Ajith                   1500000
       106                         3000000

7 rows selected.

SQL> select * from Detail where name is null;

        ID NAME                     SALARY
---------- -------------------- ----------
       106                         3000000

SQL> select * from Detail where name is not  null;

        ID NAME                     SALARY
---------- -------------------- ----------
       101 Logesh                  1500000
       101 Gokul                   1500000
       102 Nithaj                  1500000
       103 Yeshwanth               1500000
       104 Gladson                 1500000
       105 Ajith                   1500000

6 rows selected.

SQL> select * from Detail where name like 'A%';

        ID NAME                     SALARY
---------- -------------------- ----------
       105 Ajith                   1500000


SQL> select * from Detail where name like '_o%';

        ID NAME                     SALARY
---------- -------------------- ----------
       101 Logesh                  1500000
       101 Gokul                   1500000

SQL> select * from Detail where name like '%t_';

        ID NAME                     SALARY
---------- -------------------- ----------
       103 Yeshwanth               1500000
       105 Ajith                   1500000

SQL> select * from Detail where name like '%t%';

        ID NAME                     SALARY
---------- -------------------- ----------
       102 Nithaj                  1500000
       103 Yeshwanth               1500000
       105 Ajith                   1500000

SQL> select * from Detail where name like '%l%';

        ID NAME                     SALARY
---------- -------------------- ----------
       101 Gokul                   1500000
       104 Gladson                 1500000

SQL> select * from Detail where name like '%g%';

        ID NAME                     SALARY
---------- -------------------- ----------
       101 Logesh                  1500000


SQL> select * from Detail where name like 'G%';

        ID NAME                     SALARY
---------- -------------------- ----------
       101 Gokul                   1500000
       104 Gladson                 1500000


SQL> select * from Detail;

        ID NAME                     SALARY
---------- -------------------- ----------
       101 Logesh                  1500000
       101 Gokul                   1500000
       102 Nithaj                  1500000
       103 Yeshwanth               1500000
       104 Gladson                 1500000
       105 Ajith                   1500000
       106                         3000000

7 rows selected.

SQL> select * from Detail order by name desc;

        ID NAME                     SALARY
---------- -------------------- ----------
       106                         3000000
       103 Yeshwanth               1500000
       102 Nithaj                  1500000
       101 Logesh                  1500000
       101 Gokul                   1500000
       104 Gladson                 1500000
       105 Ajith                   1500000

7 rows selected.


SQL> alter table Detail add doj date;

Table altered.


SQL> select * from Detail;

        ID NAME                     SALARY DOJ
---------- -------------------- ---------- ---------
       101 Logesh                  1500000
       101 Gokul                   1500000
       102 Nithaj                  1500000
       103 Yeshwanth               1500000
       104 Gladson                 1500000
       105 Ajith                   1500000
       106                         3000000

7 rows selected.

SQL> desc Detail;
 Name                                      Null?    Type
 ----------------------------------------- -------- ----------------------------
 ID                                                 NUMBER(5)
 NAME                                               VARCHAR2(20)
 SALARY                                             NUMBER(8)
 DOJ                                                DATE

SQL> update Detail set doj=sysdate where id=103;

1 row updated.

SQL> update Detail set doj='05-AUG-2024' where id in (101,105);

3 rows updated.

SQL> select * from Detail;

        ID NAME                     SALARY DOJ
---------- -------------------- ---------- ---------
       101 Logesh                  1500000 05-AUG-24
       101 Gokul                   1500000 05-AUG-24
       102 Nithaj                  1500000
       103 Yeshwanth               1500000 07-AUG-24
       104 Gladson                 1500000
       105 Ajith                   1500000 05-AUG-24
       106                         3000000

7 rows selected.

SQL> update Detail set doj='05-AUG-2024' where id in (102,104,106);

3 rows updated.

SQL> select * from Detail;

        ID NAME                     SALARY DOJ
---------- -------------------- ---------- ---------
       101 Logesh                  1500000 05-AUG-24
       101 Gokul                   1500000 05-AUG-24
       102 Nithaj                  1500000 05-AUG-24
       103 Yeshwanth               1500000 07-AUG-24
       104 Gladson                 1500000 05-AUG-24
       105 Ajith                   1500000 05-AUG-24
       106                         3000000 05-AUG-24

7 rows selected.

SQL> commit;

Commit complete.

SQL>
SQL>  alter table Detail drop column doj;

Table altered.


SQL> select * from Detail;

        ID NAME                     SALARY
---------- -------------------- ----------
       101 Logesh                  1500000
       101 Gokul                   1500000
       102 Nithaj                  1500000
       103 Yeshwanth               1500000
       104 Gladson                 1500000
       105 Ajith                   1500000
       106                         3000000

7 rows selected.

SQL> desc Detail;
 Name                                      Null?    Type
 ----------------------------------------- -------- ----------------------------
 ID                                                 NUMBER(5)
 NAME                                               VARCHAR2(20)
 SALARY                                             NUMBER(8)

SQL> alter table Detail modify salary number(10);

Table altered.

SQL> desc Detail;
 Name                                      Null?    Type
 ----------------------------------------- -------- ----------------------------
 ID                                                 NUMBER(5)
 NAME                                               VARCHAR2(20)
 SALARY                                             NUMBER(10)




SQL> alter table Detail modify salary number(12);

Table altered.



SQL> alter table Detail rename column salary to expenses;

Table altered.

SQL> select * from Detail;

        ID NAME                   EXPENSES
---------- -------------------- ----------
       101 Logesh                  1500000
       101 Gokul                   1500000
       102 Nithaj                  1500000
       103 Yeshwanth               1500000
       104 Gladson                 1500000
       105 Ajith                   1500000
       106                         3000000

7 rows selected.

SQL> rename Detail to Information;

Table renamed.



SQL> select * from Information;

        ID NAME                   EXPENSES
---------- -------------------- ----------
       101 Logesh                  1500000
       101 Gokul                   1500000
       102 Nithaj                  1500000
       103 Yeshwanth               1500000
       104 Gladson                 1500000
       105 Ajith                   1500000
       106                         3000000

7 rows selected.

SQL> drop table Information;

Table dropped.


SQL> rollback;

Rollback complete.




SQL>
SQL>



