SQL> connect system
Enter password:
Connected.
SQL> desc Details
 Name                                      Null?    Type
 ----------------------------------------- -------- ----------------------------
 ID                                                 NUMBER(5)
 NAME                                               VARCHAR2(20)
 SALARAY                                            NUMBER(8)

SQL> cls
SP2-0042: unknown command "cls" - rest of line ignored.
SQL> select * from Details
  2
SQL> select * from Details;

no rows selected

SQL> create table Detail(id number(5),name varchar2(20),salary number(8));

Table created.

SQL> insert into Detail values(101,'Logesh',1500000);

1 row created.

SQL> insert into Detail values(101,'Gokul',1500000);;
insert into Detail values(101,'Gokul',1500000);
                                              *
ERROR at line 1:
ORA-00911: invalid character


SQL> insert into Detail values(101,'Gokul',1500000);

1 row created.

SQL> insert into Detail values(102,'Nithaj',1500000);

1 row created.

SQL> insert into Detail values(103,'Yeshwanth',1500000);

1 row created.

SQL> insert into Detail values(104,'Gladson',1500000);

1 row created.

SQL> insert into Detail values(105,'Ajith',1500000);

1 row created.

SQL> select * from Detail
  2
SQL> select * from Detail;

        ID NAME                     SALARY
---------- -------------------- ----------
       101 Logesh                  1500000
       101 Gokul                   1500000
       102 Nithaj                  1500000
       103 Yeshwanth               1500000
       104 Gladson                 1500000
       105 Ajith                   1500000

6 rows selected.

SQL> commit
  2
SQL> commit;

Commit complete.

SQL> select * from Details
  2
SQL> select * from Details;

no rows selected

SQL> select * from Detail;

        ID NAME                     SALARY
---------- -------------------- ----------
       101 Logesh                  1500000
       101 Gokul                   1500000
       102 Nithaj                  1500000
       103 Yeshwanth               1500000
       104 Gladson                 1500000
       105 Ajith                   1500000

6 rows selected.

SQL> select * from Detail where id in(101,102,105);

        ID NAME                     SALARY
---------- -------------------- ----------
       101 Logesh                  1500000
       101 Gokul                   1500000
       102 Nithaj                  1500000
       105 Ajith                   1500000

SQL> select * from Detail where id not in(101,102,105);

        ID NAME                     SALARY
---------- -------------------- ----------
       103 Yeshwanth               1500000
       104 Gladson                 1500000

SQL> select * from Detail where salary between 10000000 and 1000000000;

no rows selected

SQL> select * from Detail where salary between 1000000 and 1000000000;

        ID NAME                     SALARY
---------- -------------------- ----------
       101 Logesh                  1500000
       101 Gokul                   1500000
       102 Nithaj                  1500000
       103 Yeshwanth               1500000
       104 Gladson                 1500000
       105 Ajith                   1500000

6 rows selected.

SQL> select * from Detail where id in (101,103,105) and salary>145000;

        ID NAME                     SALARY
---------- -------------------- ----------
       101 Logesh                  1500000
       101 Gokul                   1500000
       103 Yeshwanth               1500000
       105 Ajith                   1500000

SQL> select * from Detail where id in (101,103,105) or  salary>145000;

        ID NAME                     SALARY
---------- -------------------- ----------
       101 Logesh                  1500000
       101 Gokul                   1500000
       102 Nithaj                  1500000
       103 Yeshwanth               1500000
       104 Gladson                 1500000
       105 Ajith                   1500000

6 rows selected.

SQL> insert into Detail values(106,3000000);
insert into Detail values(106,3000000)
            *
ERROR at line 1:
ORA-00947: not enough values


SQL> insert into Detail values((id,salary)values (106,3000000);
insert into Detail values((id,salary)values (106,3000000)
                             *
ERROR at line 1:
ORA-00907: missing right parenthesis


SQL> insert into Detail ((id,salary)values (106,3000000);
insert into Detail ((id,salary)values (106,3000000)
                     *
ERROR at line 1:
ORA-00928: missing SELECT keyword


SQL> insert into Detail (id,salary)values (106,3000000);

1 row created.

SQL> commit;

Commit complete.

SQL> select 8 from Detail
  2  select 8 from Detail
  3
SQL> select * from Detail;

        ID NAME                     SALARY
---------- -------------------- ----------
       101 Logesh                  1500000
       101 Gokul                   1500000
       102 Nithaj                  1500000
       103 Yeshwanth               1500000
       104 Gladson                 1500000
       105 Ajith                   1500000
       106                         3000000

7 rows selected.

SQL> select * from Detail where name is null;

        ID NAME                     SALARY
---------- -------------------- ----------
       106                         3000000

SQL> select * from Detail where name is not  null;

        ID NAME                     SALARY
---------- -------------------- ----------
       101 Logesh                  1500000
       101 Gokul                   1500000
       102 Nithaj                  1500000
       103 Yeshwanth               1500000
       104 Gladson                 1500000
       105 Ajith                   1500000

6 rows selected.

SQL> commit
  2
SQL> commit;

Commit complete.

SQL> rollback;

Rollback complete.

SQL> select * from Detail;

        ID NAME                     SALARY
---------- -------------------- ----------
       101 Logesh                  1500000
       101 Gokul                   1500000
       102 Nithaj                  1500000
       103 Yeshwanth               1500000
       104 Gladson                 1500000
       105 Ajith                   1500000
       106                         3000000

7 rows selected.

SQL> select * from Detail where name is null;

        ID NAME                     SALARY
---------- -------------------- ----------
       106                         3000000

SQL> select * from Detail where name is not  null;

        ID NAME                     SALARY
---------- -------------------- ----------
       101 Logesh                  1500000
       101 Gokul                   1500000
       102 Nithaj                  1500000
       103 Yeshwanth               1500000
       104 Gladson                 1500000
       105 Ajith                   1500000

6 rows selected.

SQL> select * from Detail where name like 'A%';

        ID NAME                     SALARY
---------- -------------------- ----------
       105 Ajith                   1500000

SQL> select * from Detail where name like '__o%';

no rows selected

SQL> select * from Detail where name like '_o%';

        ID NAME                     SALARY
---------- -------------------- ----------
       101 Logesh                  1500000
       101 Gokul                   1500000

SQL> select * from Detail where name like '_o__';

no rows selected

SQL> select * from Detail where name like '_o_';

no rows selected

SQL> select * from Detail where name like 't_';

no rows selected

SQL> select * from Detail where name like '%t_';

        ID NAME                     SALARY
---------- -------------------- ----------
       103 Yeshwanth               1500000
       105 Ajith                   1500000

SQL> select * from Detail where name like '%t%';

        ID NAME                     SALARY
---------- -------------------- ----------
       102 Nithaj                  1500000
       103 Yeshwanth               1500000
       105 Ajith                   1500000

SQL> select * from Detail where name like '%l%';

        ID NAME                     SALARY
---------- -------------------- ----------
       101 Gokul                   1500000
       104 Gladson                 1500000

SQL> select * from Detail where name like '%g%';

        ID NAME                     SALARY
---------- -------------------- ----------
       101 Logesh                  1500000

SQL> select * from Detail where name like '_g%';

no rows selected

SQL> select * from Detail where name like 'g';

no rows selected

SQL> select * from Detail where name like 'G';

no rows selected

SQL> select * from Detail where name like 'G%';

        ID NAME                     SALARY
---------- -------------------- ----------
       101 Gokul                   1500000
       104 Gladson                 1500000

SQL> select * from table
  2
SQL> select * from table;
select * from table
                  *
ERROR at line 1:
ORA-00906: missing left parenthesis


SQL> select * from Detail;

        ID NAME                     SALARY
---------- -------------------- ----------
       101 Logesh                  1500000
       101 Gokul                   1500000
       102 Nithaj                  1500000
       103 Yeshwanth               1500000
       104 Gladson                 1500000
       105 Ajith                   1500000
       106                         3000000

7 rows selected.

SQL> select * from Detail order by name desc;

        ID NAME                     SALARY
---------- -------------------- ----------
       106                         3000000
       103 Yeshwanth               1500000
       102 Nithaj                  1500000
       101 Logesh                  1500000
       101 Gokul                   1500000
       104 Gladson                 1500000
       105 Ajith                   1500000

7 rows selected.

SQL> alter * from Detail;
alter * from Detail
      *
ERROR at line 1:
ORA-00940: invalid ALTER command


SQL> alter table Detail add doj date;

Table altered.

SQL> select * from table Detail;
select * from table Detail
                    *
ERROR at line 1:
ORA-00906: missing left parenthesis


SQL> select * from Detail;

        ID NAME                     SALARY DOJ
---------- -------------------- ---------- ---------
       101 Logesh                  1500000
       101 Gokul                   1500000
       102 Nithaj                  1500000
       103 Yeshwanth               1500000
       104 Gladson                 1500000
       105 Ajith                   1500000
       106                         3000000

7 rows selected.

SQL> desc Detail;
 Name                                      Null?    Type
 ----------------------------------------- -------- ----------------------------
 ID                                                 NUMBER(5)
 NAME                                               VARCHAR2(20)
 SALARY                                             NUMBER(8)
 DOJ                                                DATE

SQL> update Detail set doj=sysdate where id=103;

1 row updated.

SQL> update Detail set doj='05-AUG-2024' where id in (101,105);

3 rows updated.

SQL> select * from Detail;

        ID NAME                     SALARY DOJ
---------- -------------------- ---------- ---------
       101 Logesh                  1500000 05-AUG-24
       101 Gokul                   1500000 05-AUG-24
       102 Nithaj                  1500000
       103 Yeshwanth               1500000 07-AUG-24
       104 Gladson                 1500000
       105 Ajith                   1500000 05-AUG-24
       106                         3000000

7 rows selected.

SQL> update Detail set doj='05-AUG-2024' where id in (102,104,106);

3 rows updated.

SQL> select * from Detail;

        ID NAME                     SALARY DOJ
---------- -------------------- ---------- ---------
       101 Logesh                  1500000 05-AUG-24
       101 Gokul                   1500000 05-AUG-24
       102 Nithaj                  1500000 05-AUG-24
       103 Yeshwanth               1500000 07-AUG-24
       104 Gladson                 1500000 05-AUG-24
       105 Ajith                   1500000 05-AUG-24
       106                         3000000 05-AUG-24

7 rows selected.

SQL> commit;

Commit complete.

SQL>
SQL>  alter table Detail drop column doj;

Table altered.

SQL> select * from Detail
  2
SQL> select * from Detail;

        ID NAME                     SALARY
---------- -------------------- ----------
       101 Logesh                  1500000
       101 Gokul                   1500000
       102 Nithaj                  1500000
       103 Yeshwanth               1500000
       104 Gladson                 1500000
       105 Ajith                   1500000
       106                         3000000

7 rows selected.

SQL> desc Detail;
 Name                                      Null?    Type
 ----------------------------------------- -------- ----------------------------
 ID                                                 NUMBER(5)
 NAME                                               VARCHAR2(20)
 SALARY                                             NUMBER(8)

SQL> alter table Detail modify salary number(10);

Table altered.

SQL> desc Detail;
 Name                                      Null?    Type
 ----------------------------------------- -------- ----------------------------
 ID                                                 NUMBER(5)
 NAME                                               VARCHAR2(20)
 SALARY                                             NUMBER(10)

SQL> alter table Detail modify salary number(5);
alter table Detail modify salary number(5)
                          *
ERROR at line 1:
ORA-01440: column to be modified must be empty to decrease precision or scale


SQL> alter table Detail modify salary number(9);
alter table Detail modify salary number(9)
                          *
ERROR at line 1:
ORA-01440: column to be modified must be empty to decrease precision or scale


SQL> alter table Detail modify salary number(12);

Table altered.

SQL> alter table Detail;
alter table Detail
                 *
ERROR at line 1:
ORA-02210: no options specified for ALTER TABLE


SQL> rename column salary to expensses;
rename column salary to expensses
       *
ERROR at line 1:
ORA-00903: invalid table name


SQL> alter table Detail rename column salary to expenses;

Table altered.

SQL> select * from Detail;

        ID NAME                   EXPENSES
---------- -------------------- ----------
       101 Logesh                  1500000
       101 Gokul                   1500000
       102 Nithaj                  1500000
       103 Yeshwanth               1500000
       104 Gladson                 1500000
       105 Ajith                   1500000
       106                         3000000

7 rows selected.

SQL> rename Detail to Information;

Table renamed.

SQL> select 8 from Detail;
select 8 from Detail
              *
ERROR at line 1:
ORA-00942: table or view does not exist


SQL> select * from Detail;
select * from Detail
              *
ERROR at line 1:
ORA-00942: table or view does not exist


SQL> select * from Information;

        ID NAME                   EXPENSES
---------- -------------------- ----------
       101 Logesh                  1500000
       101 Gokul                   1500000
       102 Nithaj                  1500000
       103 Yeshwanth               1500000
       104 Gladson                 1500000
       105 Ajith                   1500000
       106                         3000000

7 rows selected.

SQL> drop table Information;

Table dropped.

SQL> source * from Information;
SP2-0734: unknown command beginning "source * f..." - rest of line ignored.
SQL> rollback;

Rollback complete.

SQL> source * from Information;
SP2-0734: unknown command beginning "source * f..." - rest of line ignored.
SQL> flashback table Information;
flashback table Information
*
ERROR at line 1:
ORA-00439: feature not enabled: Flashback Table


SQL>
SQL>



